{"findings":[],"invocationBudget":28,"planDigest":"sha256:9b9029c4e3d92c65880b53a518b78f6a6f7e44afd89f60c413e5672432b0976c","reviewType":"code","roster":["Claude Opus 5 (copilot)","GPT-5.6 Sol (copilot)"],"runId":"fda8da1a-0347-4cca-842b-0e90931fbfa4","schema":"skalary/review-run@1","scope":"Uncommitted final runtime-evidence review for plan c21cdc step 3.1; Critical/High high-confidence functional source/test defects only; generated review artifacts and documentation style excluded.","tasks":[{"concern":"architecture-patterns","model":"Claude Opus 5 (copilot)","outcome":"completed","taskId":"architecture-patterns-m1"},{"concern":"architecture-patterns","model":"GPT-5.6 Sol (copilot)","outcome":"completed","taskId":"architecture-patterns-m2"},{"concern":"correctness-reliability","model":"Claude Opus 5 (copilot)","outcome":"completed","taskId":"correctness-reliability-m1"},{"concern":"correctness-reliability","model":"GPT-5.6 Sol (copilot)","outcome":"completed","taskId":"correctness-reliability-m2"},{"concern":"maintainability-consistency","model":"Claude Opus 5 (copilot)","outcome":"completed","taskId":"maintainability-consistency-m1"},{"concern":"maintainability-consistency","model":"GPT-5.6 Sol (copilot)","outcome":"completed","taskId":"maintainability-consistency-m2"},{"concern":"operability-observability","model":"Claude Opus 5 (copilot)","outcome":"completed","taskId":"operability-observability-m1"},{"concern":"operability-observability","model":"GPT-5.6 Sol (copilot)","outcome":"completed","taskId":"operability-observability-m2"},{"concern":"performance","model":"Claude Opus 5 (copilot)","outcome":"completed","taskId":"performance-m1"},{"concern":"performance","model":"GPT-5.6 Sol (copilot)","outcome":"completed","taskId":"performance-m2"},{"concern":"security","model":"Claude Opus 5 (copilot)","outcome":"completed","taskId":"security-m1"},{"concern":"security","model":"GPT-5.6 Sol (copilot)","outcome":"completed","taskId":"security-m2"},{"concern":"testing-evidence","model":"Claude Opus 5 (copilot)","outcome":"completed","taskId":"testing-evidence-m1"},{"concern":"testing-evidence","model":"GPT-5.6 Sol (copilot)","outcome":"completed","taskId":"testing-evidence-m2"}]}
